삼겹살,상추,상추는 포만감을 일으켜 삼겹살의 과잉 섭취를 막는다. 따라서 체중 조절에 도움이 된다.
깻잎,삼겹살,"깻잎에 부족한 단백질을 삼겹살이 보완해주고, 삼겹살에 부족한 칼슘, 무기질, 비타민 A, B, C를 깻잎이 보완해준다. 또한 깻잎의 비타민 C는 고기를 구울 때 생기는 발암물질 타르를 제거해준다."
마늘,삼겹살,마늘의 알리신 성분이 삼겹살의 비타민 B1 흡수를 돕는다. 
삼겹살,와인,와인의 알칼리 성분이 돼지고기 섭취로 인한 산성화되는 몸을 중화시킨다.
삼겹살,새우젓,새우젓은 돼지고기로 섭취된 단백질과 지방을 빠르게 소화시켜주는 역할을 한다.
삼겹살,파인애플,파인애플의 브로멜린이 소화작용을 도우며 돼지고기를 부드럽게 해준다. 
계란(달걀),토마토,"토마토는 계란(달걀)에 부족한 비타민 C와 식이섬유를 채워주며, 계란(달걀)은 토마토에 부족한 단백질을 채워준다."
계란(달걀),치즈,치즈가 칼슘이 부족한 계란(달걀)에 칼슘을 더해준다.
계란(달걀),북어,달걀이 북어의 단백질과 반응하여 단백질 영양 효율을 향상시킨다.
김,두부,콩 제품을 먹을 때 요오드 부족을 김이 채워준다.
시리얼,우유,"시리얼은 비타민과 철분, 아연이 풍부해 우유와 함께 먹게 되면 단백질, 칼슘 섭취량까지 높일 수 있다."
돼지고기,양파,양파는 수분이 많아 육류의 느끼한 맛을 잡는데 제격이고 체지방분해를 돕는다. 혈액순환과 변비예방효과도 있다.
삼겹살,양파,양파는 수분이 많아 육류의 느끼한 맛을 잡는데 제격이고 체지방분해를 돕는 성분이 있어 돼지고기와 잘 맞는다. 혈액순환과 변비예방효과도 있다.
올리브유(올리브오일),토마토,항산화 항암효능이 있는 라이코펜 성분이 풍부한 토마토는 지용성 올리브유와 함께 먹으면 흡수율이 5배나 높아진다.
사과,포도,혈전 방지 및 심장 건강을 지켜준다.
고구마,사과,가스가 생기기 쉬운 고구마를 사과가 막아준다.
브로콜리,토마토,전립선암을 예방하는 효과가 있다.
된장,바지락,바지락은 된장에 부족한 동물성 단백질을 바지락에서 보충해준다. 또한 된장은 바지락에 부족한 식물성 단백질을 보충시켜준다. 
바나나,우유,"바나나는 우유의 비타민D, 칼슘, 마그네슘의 흡수를 높여주는 효능이 있다."
돼지고기,쭈꾸미,돼지고기 섭취로 인한 콜레스테롤 위험을 쭈꾸미가 줄여준다.
브로콜리,소고기,소고기에 함유된 철분은 체내 흡수율이 낮기 때문에 비타민 C가 많은 브로콜리와 함께 섭취해 주면 좋다.
도라지,오리고기,면역력 증강 및 항암효과가 있다.
강황,후추,후추가 강황의 흡수를 돕는다.
연어,생크림,연어의 비타민 D가 유제품의 칼슘을 흡수한다.
새우,표고버섯,"표고버섯에는 콜레스테롤 수치를 저하시키는 작용이 있으며, 성인병 예방에 좋다."
맥주,과일,맥주의 높은 열량이 감소될 수 있다.
소주,생선찌개,맵고 짠맛이 적어 궤양을 일으키는 것을 예방해 준다.
당근,식용유,당근을 식용유로 조리하면 날로 먹는 것보다 영양이 보존된다.
쇠고기(소고기),배,"고기에 배를 섞으면 단백질 분해 작용이 일어나며 고기가 연해지고 맛이 좋아진다. 병후회복, 영양보충에 좋다."
새우,레몬,새우요리에 레몬을 곁들이면 상큼한 맛이 입맛을 돋우고 산성과 알칼리성의 조화로 균형있는 영양식이 된다.
과메기,미역,콜레스테롤을 배출해준다.
바나나,브로콜리,피부가 거칠어지는 것 방지해준다.
바나나,두유,얼굴이나 다리의 붓기 제거에 좋다.
계란(달걀),복어,달걀이 복어에 들어있는 단백질 영양 효율을 높여준다.
냉면,식초,영양 및 위생에 효과가 있다.
떡,무,소화를 돕는다.
커피,치즈,위벽과 소화기관을 보호한다.
아보카도,토마토,토마토는 아보카도의 건강한 지방 흡수를 돕는다.
바나나,김치,"바나나 먹을 때 퍽퍽함을 없앤다. 김치의 강한 맛과 향, 매운맛을 중화시키고. 염분 섭취 함량을 낮춘다. 포만감을 빨리 느껴 다이어트에 좋다."
라면,우유,우유에 풍부한 칼슘과 칼륨이 몸의 나트륨 배출을 원활하게 한다.
쌀,콩,"쌀에는 단백질로 필수아미노산, 라이신이 적고  유황 함유 아미노산인 메치오닌이 많은 편인데  비해  콩에는  단백질과 라이신이 많으나  메치오닌이  적다. 그러므로  쌀과 콩 제품을 합치면 단백질의 영양효과가  상승한다.  또 콩은 상대적으로 쌀에  적게  들어  있는  비타민B1을 많이 가지고 있다."
라면,녹색채소,라면에 채소를 곁들이게 되면 여러 가지 영양성분의 보완도 되지만 소금의 나트륨 작용을 상쇄시키는 칼륨을 많이 가지고 있어 이 길항작용의 중요성을 쉽게 알 수 있다.
파,육류,파는 육류를 조리하거나 먹을 때 곁들이면 고기의 좋지 못한 냄새를 중화시키고 위액분비를  촉진시켜 육류소화를 도와주는 작용을 한다.                                   
토마토,소금,"토마토를 소금과 함께 먹으면 토마토의 단맛이 더 강해지면서 비타민C가 산화되는 것을 막아주고, 세포의 에너지 활동이 활발해지게 도와준다."
